"1 & 2 Timothy","Barton, Dr. Bruce B.","Bible Study of 1 & 2 Timothy","Bible Study","9781414326528","English"
"1 &2 Corinthians","Cook, David","From the Smart Guide to the Bible Series","Bible Study","4185-1013-1","English"
"FAX Facsimile Technology and Application","McConnell, Kenneth","FAX theory and operation","Design","0890064954","English"
"Matthew","MacAuthur, John","Bible Study on the Gospel of Matthew","Bible Study","9787183513","English"
"My Title","Kellam, Richard","this is a test
another line
last line","Test genre","99988","English"
"Share Jesus Without Fear","Fay, William","A book to help you to witness","Bible Study, Self Help","0805418393","English"
"The Wiersbe Bible Study Series Job","Galvin, Dr James C.","A Study of the book of Job","Bible Study","9780781406345","English"
